{
  "$schema": "../../../report-part.schema.json",
  "capabilities": [
    {
      "category": "cli-command",
      "classification": "behavioral",
      "id": "cli.command.rules_list",
      "mismatch": null,
      "result": "same",
      "typescript": {
        "available": true,
        "evidence": [
          "packages/core/data/cli/commands/rules.json",
          "{\"browserBehavior\":null,\"group\":\"rules\",\"subcommand\":\"list\",\"surfaces\":[\"node\",\"browser\"]}"
        ]
      },
      "unreal": {
        "available": true,
        "evidence": [
          "Content/Data/cli/commands/rules.json",
          "{\"browserBehavior\":null,\"group\":\"rules\",\"subcommand\":\"list\",\"surfaces\":[\"node\",\"browser\"]}"
        ]
      }
    },
    {
      "category": "cli-command",
      "classification": "behavioral",
      "id": "cli.command.rules_presets",
      "mismatch": null,
      "result": "same",
      "typescript": {
        "available": true,
        "evidence": [
          "packages/core/data/cli/commands/rules.json",
          "{\"browserBehavior\":null,\"group\":\"rules\",\"subcommand\":\"presets\",\"surfaces\":[\"node\",\"browser\"]}"
        ]
      },
      "unreal": {
        "available": true,
        "evidence": [
          "Content/Data/cli/commands/rules.json",
          "{\"browserBehavior\":null,\"group\":\"rules\",\"subcommand\":\"presets\",\"surfaces\":[\"node\",\"browser\"]}"
        ]
      }
    }
  ],
  "generatedBy": "scripts/check-sdk-parity.py",
  "reportId": "sdk-capability-parity.cli-rules.001",
  "schemaVersion": 1,
  "sources": {
    "typescript": {
      "commit": "f2fb41b528d8a0b14289e401da50cb61fc9e94b4",
      "contractHashes": {
        "sdk-source-and-cli-contract": "9bf3c6ce68de9c5db2f274c2d33f739eb7148d7d343e05dda4a47a7e23b26d88"
      },
      "repository": "sdk"
    },
    "unreal": {
      "commit": "6c6fe1241f27abc1dae7b421d9f1c0fa4506bc38",
      "contractHashes": {
        "sdk-source-and-cli-contract": "19d0d3a4ab3c9504e584c7d2f396b635e3883e0182aad5c65ec17d5e8ff8c45a"
      },
      "repository": "sdk-ue-5"
    }
  },
  "summary": {
    "capabilityCount": 2,
    "expectedMechanicCount": 0,
    "mismatchCount": 0,
    "sameCount": 2,
    "status": "passed"
  }
}
