{
  "$schema": "../../../report-part.schema.json",
  "capabilities": [
    {
      "category": "source-structure",
      "classification": "runtime-mechanic",
      "id": "structure.micro-game.files",
      "mismatch": null,
      "result": "expected-mechanic",
      "typescript": {
        "available": true,
        "evidence": [
          "count=114",
          "packages/micro-game-cli/src/features/systems/chat/testing/testingAdapters.ts",
          "packages/micro-game-cli/src/features/systems/cli/testing/testingAdapters.ts",
          "packages/micro-game-cli/src/features/systems/harness/commandRunner/debug/debugAdapters.ts",
          "packages/micro-game-cli/src/features/systems/harness/commandRunner/testing/testingAdapters.ts",
          "packages/micro-game-cli/src/features/systems/harness/maze/commands/commandsAdapters.ts"
        ]
      },
      "unreal": {
        "available": true,
        "evidence": [
          "count=170",
          "exact=81"
        ]
      }
    },
    {
      "category": "source-structure",
      "classification": "runtime-mechanic",
      "id": "structure.micro-game.folders",
      "mismatch": null,
      "result": "expected-mechanic",
      "typescript": {
        "available": true,
        "evidence": [
          "count=72",
          "packages/micro-game-cli/src/features/systems/chat/testing",
          "packages/micro-game-cli/src/features/systems/cli/testing",
          "packages/micro-game-cli/src/features/systems/harness/commandRunner/debug",
          "packages/micro-game-cli/src/features/systems/harness/commandRunner/testing",
          "packages/micro-game-cli/src/features/systems/harness/maze/commands"
        ]
      },
      "unreal": {
        "available": true,
        "evidence": [
          "count=125",
          "exact=54"
        ]
      }
    },
    {
      "category": "source-structure",
      "classification": "runtime-mechanic",
      "id": "structure.micro-game.symbols",
      "mismatch": null,
      "result": "expected-mechanic",
      "typescript": {
        "available": true,
        "evidence": [
          "count=419",
          "packages/micro-game-cli/src/features/systems/chat/chatTypes.ts",
          "packages/micro-game-cli/src/features/systems/chat/testing/testingAdapters.ts",
          "packages/micro-game-cli/src/features/systems/cli/cliAdapters.ts",
          "packages/micro-game-cli/src/features/systems/cli/cliThunks.ts"
        ]
      },
      "unreal": {
        "available": true,
        "evidence": [
          "count=792",
          "exact=198"
        ]
      }
    },
    {
      "category": "source-structure",
      "classification": "runtime-mechanic",
      "id": "structure.sdk.files",
      "mismatch": null,
      "result": "expected-mechanic",
      "typescript": {
        "available": true,
        "evidence": [
          "count=207",
          "packages/core/src/components/api/connection/connectionTypes.ts",
          "packages/core/src/components/api/status/statusTypes.ts",
          "packages/core/src/components/npc/persona/personaTypes.ts",
          "packages/core/src/components/protocol/handlers/handlersTypes.ts",
          "packages/core/src/components/sdk/sdkTypes.ts"
        ]
      },
      "unreal": {
        "available": true,
        "evidence": [
          "count=450",
          "exact=101"
        ]
      }
    },
    {
      "category": "source-structure",
      "classification": "runtime-mechanic",
      "id": "structure.sdk.folders",
      "mismatch": null,
      "result": "expected-mechanic",
      "typescript": {
        "available": true,
        "evidence": [
          "count=165",
          "packages/core/src/components/api/connection",
          "packages/core/src/components/api/status",
          "packages/core/src/components/npc/persona",
          "packages/core/src/components/protocol/handlers",
          "packages/core/src/components/sdk"
        ]
      },
      "unreal": {
        "available": true,
        "evidence": [
          "count=430",
          "exact=93"
        ]
      }
    },
    {
      "category": "source-structure",
      "classification": "runtime-mechanic",
      "id": "structure.sdk.symbols",
      "mismatch": null,
      "result": "expected-mechanic",
      "typescript": {
        "available": true,
        "evidence": [
          "count=807",
          "packages/core/src/components/api/connection/connectionTypes.ts",
          "packages/core/src/components/bridge/bridgeTypes.ts"
        ]
      },
      "unreal": {
        "available": true,
        "evidence": [
          "count=2815",
          "exact=415"
        ]
      }
    },
    {
      "category": "source-structure",
      "classification": "runtime-mechanic",
      "id": "structure.source-roots",
      "mismatch": null,
      "result": "expected-mechanic",
      "typescript": {
        "available": true,
        "evidence": [
          "packages/browser/src",
          "packages/micro-game-browser/src"
        ]
      },
      "unreal": {
        "available": true,
        "evidence": []
      }
    }
  ],
  "generatedBy": "scripts/check-sdk-parity.py",
  "reportId": "sdk-capability-parity.source-structure.001",
  "schemaVersion": 1,
  "sources": {
    "typescript": {
      "commit": "f2fb41b528d8a0b14289e401da50cb61fc9e94b4",
      "contractHashes": {
        "sdk-source-and-cli-contract": "9bf3c6ce68de9c5db2f274c2d33f739eb7148d7d343e05dda4a47a7e23b26d88"
      },
      "repository": "sdk"
    },
    "unreal": {
      "commit": "6c6fe1241f27abc1dae7b421d9f1c0fa4506bc38",
      "contractHashes": {
        "sdk-source-and-cli-contract": "19d0d3a4ab3c9504e584c7d2f396b635e3883e0182aad5c65ec17d5e8ff8c45a"
      },
      "repository": "sdk-ue-5"
    }
  },
  "summary": {
    "capabilityCount": 7,
    "expectedMechanicCount": 7,
    "mismatchCount": 0,
    "sameCount": 0,
    "status": "passed"
  }
}
