{
  "$schema": "../../../report-part.schema.json",
  "capabilities": [
    {
      "category": "cli-command",
      "classification": "behavioral",
      "id": "cli.command.soul_chat",
      "mismatch": null,
      "result": "same",
      "typescript": {
        "available": true,
        "evidence": [
          "packages/core/data/cli/commands/soul.json",
          "{\"browserBehavior\":null,\"group\":\"soul\",\"subcommand\":\"chat\",\"surfaces\":[\"node\",\"browser\"]}"
        ]
      },
      "unreal": {
        "available": true,
        "evidence": [
          "Content/Data/cli/commands/soul.json",
          "{\"browserBehavior\":null,\"group\":\"soul\",\"subcommand\":\"chat\",\"surfaces\":[\"node\",\"browser\"]}"
        ]
      }
    },
    {
      "category": "cli-command",
      "classification": "behavioral",
      "id": "cli.command.soul_export",
      "mismatch": null,
      "result": "same",
      "typescript": {
        "available": true,
        "evidence": [
          "packages/core/data/cli/commands/soul.json",
          "{\"browserBehavior\":null,\"group\":\"soul\",\"subcommand\":\"export\",\"surfaces\":[\"node\",\"browser\"]}"
        ]
      },
      "unreal": {
        "available": true,
        "evidence": [
          "Content/Data/cli/commands/soul.json",
          "{\"browserBehavior\":null,\"group\":\"soul\",\"subcommand\":\"export\",\"surfaces\":[\"node\",\"browser\"]}"
        ]
      }
    },
    {
      "category": "cli-command",
      "classification": "behavioral",
      "id": "cli.command.soul_import",
      "mismatch": null,
      "result": "same",
      "typescript": {
        "available": true,
        "evidence": [
          "packages/core/data/cli/commands/soul.json",
          "{\"browserBehavior\":null,\"group\":\"soul\",\"subcommand\":\"import\",\"surfaces\":[\"node\",\"browser\"]}"
        ]
      },
      "unreal": {
        "available": true,
        "evidence": [
          "Content/Data/cli/commands/soul.json",
          "{\"browserBehavior\":null,\"group\":\"soul\",\"subcommand\":\"import\",\"surfaces\":[\"node\",\"browser\"]}"
        ]
      }
    },
    {
      "category": "cli-command",
      "classification": "behavioral",
      "id": "cli.command.soul_list",
      "mismatch": null,
      "result": "same",
      "typescript": {
        "available": true,
        "evidence": [
          "packages/core/data/cli/commands/soul.json",
          "{\"browserBehavior\":null,\"group\":\"soul\",\"subcommand\":\"list\",\"surfaces\":[\"node\",\"browser\"]}"
        ]
      },
      "unreal": {
        "available": true,
        "evidence": [
          "Content/Data/cli/commands/soul.json",
          "{\"browserBehavior\":null,\"group\":\"soul\",\"subcommand\":\"list\",\"surfaces\":[\"node\",\"browser\"]}"
        ]
      }
    },
    {
      "category": "cli-command",
      "classification": "behavioral",
      "id": "cli.command.soul_verify",
      "mismatch": null,
      "result": "same",
      "typescript": {
        "available": true,
        "evidence": [
          "packages/core/data/cli/commands/soul.json",
          "{\"browserBehavior\":null,\"group\":\"soul\",\"subcommand\":\"verify\",\"surfaces\":[\"node\",\"browser\"]}"
        ]
      },
      "unreal": {
        "available": true,
        "evidence": [
          "Content/Data/cli/commands/soul.json",
          "{\"browserBehavior\":null,\"group\":\"soul\",\"subcommand\":\"verify\",\"surfaces\":[\"node\",\"browser\"]}"
        ]
      }
    }
  ],
  "generatedBy": "scripts/check-sdk-parity.py",
  "reportId": "sdk-capability-parity.cli-soul.001",
  "schemaVersion": 1,
  "sources": {
    "typescript": {
      "commit": "f2fb41b528d8a0b14289e401da50cb61fc9e94b4",
      "contractHashes": {
        "sdk-source-and-cli-contract": "9bf3c6ce68de9c5db2f274c2d33f739eb7148d7d343e05dda4a47a7e23b26d88"
      },
      "repository": "sdk"
    },
    "unreal": {
      "commit": "b0c083230a707acb2e54a8fd10c1bcb57f99ef5c",
      "contractHashes": {
        "sdk-source-and-cli-contract": "c61d301877c8b8ab563a17bb4b8ae21fb7b733a180c97011f8343291d57783c5"
      },
      "repository": "sdk-ue-5"
    }
  },
  "summary": {
    "capabilityCount": 5,
    "expectedMechanicCount": 0,
    "mismatchCount": 0,
    "sameCount": 5,
    "status": "passed"
  }
}
