{
  "$schema": "../../../report-part.schema.json",
  "capabilities": [
    {
      "category": "rtk-export",
      "classification": "behavioral",
      "id": "rtk.toolkit-runtime.createListenerMiddleware",
      "mismatch": null,
      "result": "same",
      "typescript": {
        "available": true,
        "evidence": [
          "createListenerMiddleware",
          "node_modules/@reduxjs/toolkit/dist/redux-toolkit.modern.mjs"
        ]
      },
      "unreal": {
        "available": true,
        "evidence": [
          "Source/ForbocAI_SDK/Public/Core/RTK/Listener/Listener.hpp"
        ]
      }
    },
    {
      "category": "rtk-export",
      "classification": "behavioral",
      "id": "rtk.toolkit-runtime.createNextState",
      "mismatch": null,
      "result": "same",
      "typescript": {
        "available": true,
        "evidence": [
          "createNextState",
          "node_modules/@reduxjs/toolkit/dist/redux-toolkit.modern.mjs"
        ]
      },
      "unreal": {
        "available": true,
        "evidence": [
          "Source/ForbocAI_SDK/Public/Core/RTK/Immer/Immer.hpp"
        ]
      }
    },
    {
      "category": "rtk-export",
      "classification": "behavioral",
      "id": "rtk.toolkit-runtime.createReducer",
      "mismatch": null,
      "result": "same",
      "typescript": {
        "available": true,
        "evidence": [
          "createReducer",
          "node_modules/@reduxjs/toolkit/dist/redux-toolkit.modern.mjs"
        ]
      },
      "unreal": {
        "available": true,
        "evidence": [
          "Source/ForbocAI_SDK/Public/Core/RTK/Slice/Slice.hpp"
        ]
      }
    },
    {
      "category": "rtk-export",
      "classification": "behavioral",
      "id": "rtk.toolkit-runtime.createSelector",
      "mismatch": null,
      "result": "same",
      "typescript": {
        "available": true,
        "evidence": [
          "createSelector",
          "node_modules/@reduxjs/toolkit/dist/redux-toolkit.modern.mjs"
        ]
      },
      "unreal": {
        "available": true,
        "evidence": [
          "Source/ForbocAI_SDK/Public/Core/RTK/Selector/Selector.hpp"
        ]
      }
    },
    {
      "category": "rtk-export",
      "classification": "behavioral",
      "id": "rtk.toolkit-runtime.createSelectorCreator",
      "mismatch": null,
      "result": "same",
      "typescript": {
        "available": true,
        "evidence": [
          "createSelectorCreator",
          "node_modules/@reduxjs/toolkit/dist/redux-toolkit.modern.mjs"
        ]
      },
      "unreal": {
        "available": true,
        "evidence": [
          "Source/ForbocAI_SDK/Public/Core/RTK/Memoization/Memoization.hpp"
        ]
      }
    },
    {
      "category": "rtk-export",
      "classification": "behavioral",
      "id": "rtk.toolkit-runtime.createSerializableStateInvariantMiddleware",
      "mismatch": null,
      "result": "same",
      "typescript": {
        "available": true,
        "evidence": [
          "createSerializableStateInvariantMiddleware",
          "node_modules/@reduxjs/toolkit/dist/redux-toolkit.modern.mjs"
        ]
      },
      "unreal": {
        "available": true,
        "evidence": [
          "Source/ForbocAI_SDK/Public/Core/RTK/Invariant/InvariantMiddleware.hpp"
        ]
      }
    },
    {
      "category": "rtk-export",
      "classification": "behavioral",
      "id": "rtk.toolkit-runtime.createSlice",
      "mismatch": null,
      "result": "same",
      "typescript": {
        "available": true,
        "evidence": [
          "createSlice",
          "node_modules/@reduxjs/toolkit/dist/redux-toolkit.modern.mjs"
        ]
      },
      "unreal": {
        "available": true,
        "evidence": [
          "Source/ForbocAI_SDK/Public/Core/RTK/Slice/Slice.hpp"
        ]
      }
    },
    {
      "category": "rtk-export",
      "classification": "behavioral",
      "id": "rtk.toolkit-runtime.createStore",
      "mismatch": null,
      "result": "same",
      "typescript": {
        "available": true,
        "evidence": [
          "createStore",
          "node_modules/@reduxjs/toolkit/dist/redux-toolkit.modern.mjs"
        ]
      },
      "unreal": {
        "available": true,
        "evidence": [
          "Source/ForbocAI_SDK/Public/Core/RTK/Action/Action.hpp",
          "Source/ForbocAI_SDK/Public/Core/RTK/ConfigureStore/ConfigureStore.hpp",
          "Source/ForbocAI_SDK/Public/Core/RTK/Store/Store.hpp"
        ]
      }
    }
  ],
  "generatedBy": "scripts/check-rtk-parity.py",
  "reportId": "rtk-public-surface-parity.toolkit-runtime.004",
  "schemaVersion": 1,
  "sources": {
    "typescript": {
      "commit": "50c1fe284da298525ea5a153d680084a06149ffe",
      "contractHashes": {
        "redux-toolkit-runtime-and-source": "506ad07549e03b33b8914d26436b37c4a23b7e45b549cfe015400e39c95b74f5"
      },
      "repository": "sdk"
    },
    "unreal": {
      "commit": "2105e827cd5495f627708fe1b12ce10f7d0c2dc7",
      "contractHashes": {
        "rtk-hpp-public-closure": "7b0722dd9ecd67441f44ca6214ffc7fdaa678084253142d0762c09729981662d"
      },
      "repository": "sdk-ue-5"
    }
  },
  "summary": {
    "capabilityCount": 8,
    "expectedMechanicCount": 0,
    "mismatchCount": 0,
    "sameCount": 8,
    "status": "passed"
  }
}
