{
  "$schema": "../../../report-part.schema.json",
  "capabilities": [
    {
      "category": "rtk-export",
      "classification": "behavioral",
      "id": "rtk.toolkit-source.createDynamicMiddleware",
      "mismatch": null,
      "result": "same",
      "typescript": {
        "available": true,
        "evidence": [
          "createDynamicMiddleware",
          "node_modules/@reduxjs/toolkit/src/index.ts"
        ]
      },
      "unreal": {
        "available": true,
        "evidence": [
          "Source/ForbocAI_SDK/Public/Core/RTK/Dynamic/DynamicMiddleware.hpp"
        ]
      }
    },
    {
      "category": "rtk-export",
      "classification": "behavioral",
      "id": "rtk.toolkit-source.createEntityAdapter",
      "mismatch": null,
      "result": "same",
      "typescript": {
        "available": true,
        "evidence": [
          "createEntityAdapter",
          "node_modules/@reduxjs/toolkit/src/index.ts"
        ]
      },
      "unreal": {
        "available": true,
        "evidence": [
          "Source/ForbocAI_SDK/Public/Core/RTK/Entity/Adapter.hpp"
        ]
      }
    },
    {
      "category": "rtk-export",
      "classification": "behavioral",
      "id": "rtk.toolkit-source.createImmutableStateInvariantMiddleware",
      "mismatch": null,
      "result": "same",
      "typescript": {
        "available": true,
        "evidence": [
          "createImmutableStateInvariantMiddleware",
          "node_modules/@reduxjs/toolkit/src/index.ts"
        ]
      },
      "unreal": {
        "available": true,
        "evidence": [
          "Source/ForbocAI_SDK/Public/Core/RTK/Invariant/InvariantMiddleware.hpp"
        ]
      }
    },
    {
      "category": "rtk-export",
      "classification": "behavioral",
      "id": "rtk.toolkit-source.createListenerMiddleware",
      "mismatch": null,
      "result": "same",
      "typescript": {
        "available": true,
        "evidence": [
          "createListenerMiddleware",
          "node_modules/@reduxjs/toolkit/src/index.ts"
        ]
      },
      "unreal": {
        "available": true,
        "evidence": [
          "Source/ForbocAI_SDK/Public/Core/RTK/Listener/Listener.hpp"
        ]
      }
    },
    {
      "category": "rtk-export",
      "classification": "behavioral",
      "id": "rtk.toolkit-source.createNextState",
      "mismatch": null,
      "result": "same",
      "typescript": {
        "available": true,
        "evidence": [
          "createNextState",
          "node_modules/@reduxjs/toolkit/src/index.ts"
        ]
      },
      "unreal": {
        "available": true,
        "evidence": [
          "Source/ForbocAI_SDK/Public/Core/RTK/Immer/Immer.hpp"
        ]
      }
    },
    {
      "category": "rtk-export",
      "classification": "behavioral",
      "id": "rtk.toolkit-source.createReducer",
      "mismatch": null,
      "result": "same",
      "typescript": {
        "available": true,
        "evidence": [
          "createReducer",
          "node_modules/@reduxjs/toolkit/src/index.ts"
        ]
      },
      "unreal": {
        "available": true,
        "evidence": [
          "Source/ForbocAI_SDK/Public/Core/RTK/Slice/Slice.hpp"
        ]
      }
    },
    {
      "category": "rtk-export",
      "classification": "behavioral",
      "id": "rtk.toolkit-source.createSelector",
      "mismatch": null,
      "result": "same",
      "typescript": {
        "available": true,
        "evidence": [
          "createSelector",
          "node_modules/@reduxjs/toolkit/src/index.ts"
        ]
      },
      "unreal": {
        "available": true,
        "evidence": [
          "Source/ForbocAI_SDK/Public/Core/RTK/Selector/Selector.hpp"
        ]
      }
    },
    {
      "category": "rtk-export",
      "classification": "behavioral",
      "id": "rtk.toolkit-source.createSelectorCreator",
      "mismatch": null,
      "result": "same",
      "typescript": {
        "available": true,
        "evidence": [
          "createSelectorCreator",
          "node_modules/@reduxjs/toolkit/src/index.ts"
        ]
      },
      "unreal": {
        "available": true,
        "evidence": [
          "Source/ForbocAI_SDK/Public/Core/RTK/Memoization/Memoization.hpp"
        ]
      }
    }
  ],
  "generatedBy": "scripts/check-rtk-parity.py",
  "reportId": "rtk-public-surface-parity.toolkit-source.014",
  "schemaVersion": 1,
  "sources": {
    "typescript": {
      "commit": "50c1fe284da298525ea5a153d680084a06149ffe",
      "contractHashes": {
        "redux-toolkit-runtime-and-source": "506ad07549e03b33b8914d26436b37c4a23b7e45b549cfe015400e39c95b74f5"
      },
      "repository": "sdk"
    },
    "unreal": {
      "commit": "e679082e67657f3c4d8f3ad0fc3a6eb7c067a021",
      "contractHashes": {
        "rtk-hpp-public-closure": "7b0722dd9ecd67441f44ca6214ffc7fdaa678084253142d0762c09729981662d"
      },
      "repository": "sdk-ue-5"
    }
  },
  "summary": {
    "capabilityCount": 8,
    "expectedMechanicCount": 0,
    "mismatchCount": 0,
    "sameCount": 8,
    "status": "passed"
  }
}
