{
  "$schema": "../../../report-part.schema.json",
  "capabilities": [
    {
      "category": "rtk-export",
      "classification": "behavioral",
      "id": "rtk.toolkit-runtime.ReducerType",
      "mismatch": null,
      "result": "same",
      "typescript": {
        "available": true,
        "evidence": [
          "ReducerType",
          "node_modules/@reduxjs/toolkit/dist/redux-toolkit.modern.mjs"
        ]
      },
      "unreal": {
        "available": true,
        "evidence": [
          "Source/ForbocAI_SDK/Public/Core/RTK/Types/Types.hpp"
        ]
      }
    },
    {
      "category": "rtk-export",
      "classification": "behavioral",
      "id": "rtk.toolkit-runtime.SHOULD_AUTOBATCH",
      "mismatch": null,
      "result": "same",
      "typescript": {
        "available": true,
        "evidence": [
          "SHOULD_AUTOBATCH",
          "node_modules/@reduxjs/toolkit/dist/redux-toolkit.modern.mjs"
        ]
      },
      "unreal": {
        "available": true,
        "evidence": [
          "Source/ForbocAI_SDK/Public/Core/RTK/Utility/Utility.hpp"
        ]
      }
    },
    {
      "category": "rtk-export",
      "classification": "behavioral",
      "id": "rtk.toolkit-runtime.TaskAbortError",
      "mismatch": null,
      "result": "same",
      "typescript": {
        "available": true,
        "evidence": [
          "TaskAbortError",
          "node_modules/@reduxjs/toolkit/dist/redux-toolkit.modern.mjs"
        ]
      },
      "unreal": {
        "available": true,
        "evidence": [
          "Source/ForbocAI_SDK/Public/Core/RTK/Utility/Utility.hpp"
        ]
      }
    },
    {
      "category": "rtk-export",
      "classification": "behavioral",
      "id": "rtk.toolkit-runtime.Tuple",
      "mismatch": null,
      "result": "same",
      "typescript": {
        "available": true,
        "evidence": [
          "Tuple",
          "node_modules/@reduxjs/toolkit/dist/redux-toolkit.modern.mjs"
        ]
      },
      "unreal": {
        "available": true,
        "evidence": [
          "Source/ForbocAI_SDK/Public/Core/RTK/Tuple/Tuple.hpp"
        ]
      }
    },
    {
      "category": "rtk-export",
      "classification": "behavioral",
      "id": "rtk.toolkit-runtime.__DO_NOT_USE__ActionTypes",
      "mismatch": null,
      "result": "same",
      "typescript": {
        "available": true,
        "evidence": [
          "__DO_NOT_USE__ActionTypes",
          "node_modules/@reduxjs/toolkit/dist/redux-toolkit.modern.mjs"
        ]
      },
      "unreal": {
        "available": true,
        "evidence": [
          "Source/ForbocAI_SDK/Public/Core/RTK/Utility/Utility.hpp"
        ]
      }
    },
    {
      "category": "rtk-export",
      "classification": "behavioral",
      "id": "rtk.toolkit-runtime.addListener",
      "mismatch": null,
      "result": "same",
      "typescript": {
        "available": true,
        "evidence": [
          "addListener",
          "node_modules/@reduxjs/toolkit/dist/redux-toolkit.modern.mjs"
        ]
      },
      "unreal": {
        "available": true,
        "evidence": [
          "Source/ForbocAI_SDK/Public/Core/RTK/Listener/Listener.hpp"
        ]
      }
    },
    {
      "category": "rtk-export",
      "classification": "behavioral",
      "id": "rtk.toolkit-runtime.applyMiddleware",
      "mismatch": null,
      "result": "same",
      "typescript": {
        "available": true,
        "evidence": [
          "applyMiddleware",
          "node_modules/@reduxjs/toolkit/dist/redux-toolkit.modern.mjs"
        ]
      },
      "unreal": {
        "available": true,
        "evidence": [
          "Source/ForbocAI_SDK/Public/Core/RTK/Middleware/Middleware.hpp"
        ]
      }
    },
    {
      "category": "rtk-export",
      "classification": "behavioral",
      "id": "rtk.toolkit-runtime.asyncThunkCreator",
      "mismatch": null,
      "result": "same",
      "typescript": {
        "available": true,
        "evidence": [
          "asyncThunkCreator",
          "node_modules/@reduxjs/toolkit/dist/redux-toolkit.modern.mjs"
        ]
      },
      "unreal": {
        "available": true,
        "evidence": [
          "Source/ForbocAI_SDK/Public/Core/RTK/Thunk/Thunk.hpp"
        ]
      }
    }
  ],
  "generatedBy": "scripts/check-rtk-parity.py",
  "reportId": "rtk-public-surface-parity.toolkit-runtime.001",
  "schemaVersion": 1,
  "sources": {
    "typescript": {
      "commit": "9275069c0c42cd9127d74781de4abce9036358a2",
      "contractHashes": {
        "redux-toolkit-runtime-and-source": "506ad07549e03b33b8914d26436b37c4a23b7e45b549cfe015400e39c95b74f5"
      },
      "repository": "sdk"
    },
    "unreal": {
      "commit": "6c6fe1241f27abc1dae7b421d9f1c0fa4506bc38",
      "contractHashes": {
        "rtk-hpp-public-closure": "bb338647c7db6e66dca13a0ef3d6587c59cbcee5ec4e2906154e8f9ba0640447"
      },
      "repository": "sdk-ue-5"
    }
  },
  "summary": {
    "capabilityCount": 8,
    "expectedMechanicCount": 0,
    "mismatchCount": 0,
    "sameCount": 8,
    "status": "passed"
  }
}
