{
  "$schema": "../../../report-part.schema.json",
  "capabilities": [
    {
      "category": "cli-command",
      "classification": "behavioral",
      "id": "cli.command.ghost_status",
      "mismatch": null,
      "result": "same",
      "typescript": {
        "available": true,
        "evidence": [
          "packages/core/data/cli/commands/ghost.json",
          "{\"browserBehavior\":null,\"group\":\"ghost\",\"subcommand\":\"status\",\"surfaces\":[\"node\",\"browser\"]}"
        ]
      },
      "unreal": {
        "available": true,
        "evidence": [
          "Content/Data/cli/commands/ghost.json",
          "{\"browserBehavior\":null,\"group\":\"ghost\",\"subcommand\":\"status\",\"surfaces\":[\"node\",\"browser\"]}"
        ]
      }
    },
    {
      "category": "cli-command",
      "classification": "behavioral",
      "id": "cli.command.ghost_stop",
      "mismatch": null,
      "result": "same",
      "typescript": {
        "available": true,
        "evidence": [
          "packages/core/data/cli/commands/ghost.json",
          "{\"browserBehavior\":null,\"group\":\"ghost\",\"subcommand\":\"stop\",\"surfaces\":[\"node\",\"browser\"]}"
        ]
      },
      "unreal": {
        "available": true,
        "evidence": [
          "Content/Data/cli/commands/ghost.json",
          "{\"browserBehavior\":null,\"group\":\"ghost\",\"subcommand\":\"stop\",\"surfaces\":[\"node\",\"browser\"]}"
        ]
      }
    },
    {
      "category": "cli-command",
      "classification": "behavioral",
      "id": "cli.command.ghost_update",
      "mismatch": null,
      "result": "same",
      "typescript": {
        "available": true,
        "evidence": [
          "packages/core/data/cli/commands/ghost.json",
          "{\"browserBehavior\":null,\"group\":\"ghost\",\"subcommand\":\"update\",\"surfaces\":[\"node\"]}"
        ]
      },
      "unreal": {
        "available": true,
        "evidence": [
          "Content/Data/cli/commands/ghost.json",
          "{\"browserBehavior\":null,\"group\":\"ghost\",\"subcommand\":\"update\",\"surfaces\":[\"node\"]}"
        ]
      }
    }
  ],
  "generatedBy": "scripts/check-sdk-parity.py",
  "reportId": "sdk-capability-parity.cli-ghost.002",
  "schemaVersion": 1,
  "sources": {
    "typescript": {
      "commit": "f2fb41b528d8a0b14289e401da50cb61fc9e94b4",
      "contractHashes": {
        "sdk-source-and-cli-contract": "9bf3c6ce68de9c5db2f274c2d33f739eb7148d7d343e05dda4a47a7e23b26d88"
      },
      "repository": "sdk"
    },
    "unreal": {
      "commit": "5cd51d43e7fe8bac369bdf7b77d9f74e85616785",
      "contractHashes": {
        "sdk-source-and-cli-contract": "6887a5d07b5d4f77b5cbf9e76da62b7f446a69f8a4da027686567d60a697c552"
      },
      "repository": "sdk-ue-5"
    }
  },
  "summary": {
    "capabilityCount": 3,
    "expectedMechanicCount": 0,
    "mismatchCount": 0,
    "sameCount": 3,
    "status": "passed"
  }
}
