{
  "$schema": "../../../report-part.schema.json",
  "capabilities": [
    {
      "category": "rtk-export",
      "classification": "behavioral",
      "id": "rtk.query-runtime.NamedSchemaError",
      "mismatch": null,
      "result": "same",
      "typescript": {
        "available": true,
        "evidence": [
          "NamedSchemaError",
          "node_modules/@reduxjs/toolkit/dist/query/rtk-query.modern.mjs"
        ]
      },
      "unreal": {
        "available": true,
        "evidence": [
          "Source/ForbocAI_SDK/Public/Core/RTK/Query/Endpoint/Endpoint.hpp",
          "Source/ForbocAI_SDK/Public/Core/RTK/Query/Types/QueryTypes.hpp"
        ]
      }
    },
    {
      "category": "rtk-export",
      "classification": "behavioral",
      "id": "rtk.query-runtime.QueryStatus",
      "mismatch": null,
      "result": "same",
      "typescript": {
        "available": true,
        "evidence": [
          "QueryStatus",
          "node_modules/@reduxjs/toolkit/dist/query/rtk-query.modern.mjs"
        ]
      },
      "unreal": {
        "available": true,
        "evidence": [
          "Source/ForbocAI_SDK/Public/Core/RTK/Query/Types/QueryTypes.hpp"
        ]
      }
    },
    {
      "category": "rtk-export",
      "classification": "behavioral",
      "id": "rtk.query-runtime._NEVER",
      "mismatch": null,
      "result": "same",
      "typescript": {
        "available": true,
        "evidence": [
          "_NEVER",
          "node_modules/@reduxjs/toolkit/dist/query/rtk-query.modern.mjs"
        ]
      },
      "unreal": {
        "available": true,
        "evidence": [
          "Source/ForbocAI_SDK/Public/Core/RTK/Query/Types/QueryTypes.hpp"
        ]
      }
    },
    {
      "category": "rtk-export",
      "classification": "behavioral",
      "id": "rtk.query-runtime.buildCreateApi",
      "mismatch": null,
      "result": "same",
      "typescript": {
        "available": true,
        "evidence": [
          "buildCreateApi",
          "node_modules/@reduxjs/toolkit/dist/query/rtk-query.modern.mjs"
        ]
      },
      "unreal": {
        "available": true,
        "evidence": [
          "Source/ForbocAI_SDK/Public/Core/RTK/Query/Api/Api.hpp"
        ]
      }
    },
    {
      "category": "rtk-export",
      "classification": "behavioral",
      "id": "rtk.query-runtime.copyWithStructuralSharing",
      "mismatch": null,
      "result": "same",
      "typescript": {
        "available": true,
        "evidence": [
          "copyWithStructuralSharing",
          "node_modules/@reduxjs/toolkit/dist/query/rtk-query.modern.mjs"
        ]
      },
      "unreal": {
        "available": true,
        "evidence": [
          "Source/ForbocAI_SDK/Public/Core/RTK/Query/StructuralSharing/StructuralSharing.hpp"
        ]
      }
    },
    {
      "category": "rtk-export",
      "classification": "behavioral",
      "id": "rtk.query-runtime.coreModule",
      "mismatch": null,
      "result": "same",
      "typescript": {
        "available": true,
        "evidence": [
          "coreModule",
          "node_modules/@reduxjs/toolkit/dist/query/rtk-query.modern.mjs"
        ]
      },
      "unreal": {
        "available": true,
        "evidence": [
          "Source/ForbocAI_SDK/Public/Core/RTK/Query/Api/Api.hpp",
          "Source/ForbocAI_SDK/Public/Core/RTK/Query/Types/QueryTypes.hpp"
        ]
      }
    },
    {
      "category": "rtk-export",
      "classification": "behavioral",
      "id": "rtk.query-runtime.coreModuleName",
      "mismatch": null,
      "result": "same",
      "typescript": {
        "available": true,
        "evidence": [
          "coreModuleName",
          "node_modules/@reduxjs/toolkit/dist/query/rtk-query.modern.mjs"
        ]
      },
      "unreal": {
        "available": true,
        "evidence": [
          "Source/ForbocAI_SDK/Public/Core/RTK/Query/Types/QueryTypes.hpp"
        ]
      }
    },
    {
      "category": "rtk-export",
      "classification": "behavioral",
      "id": "rtk.query-runtime.createApi",
      "mismatch": null,
      "result": "same",
      "typescript": {
        "available": true,
        "evidence": [
          "createApi",
          "node_modules/@reduxjs/toolkit/dist/query/rtk-query.modern.mjs"
        ]
      },
      "unreal": {
        "available": true,
        "evidence": [
          "Source/ForbocAI_SDK/Public/Core/RTK/Query/Api/Api.hpp"
        ]
      }
    }
  ],
  "generatedBy": "scripts/check-rtk-parity.py",
  "reportId": "rtk-public-surface-parity.query-runtime.001",
  "schemaVersion": 1,
  "sources": {
    "typescript": {
      "commit": "50c1fe284da298525ea5a153d680084a06149ffe",
      "contractHashes": {
        "redux-toolkit-runtime-and-source": "506ad07549e03b33b8914d26436b37c4a23b7e45b549cfe015400e39c95b74f5"
      },
      "repository": "sdk"
    },
    "unreal": {
      "commit": "e679082e67657f3c4d8f3ad0fc3a6eb7c067a021",
      "contractHashes": {
        "rtk-hpp-public-closure": "7b0722dd9ecd67441f44ca6214ffc7fdaa678084253142d0762c09729981662d"
      },
      "repository": "sdk-ue-5"
    }
  },
  "summary": {
    "capabilityCount": 8,
    "expectedMechanicCount": 0,
    "mismatchCount": 0,
    "sameCount": 8,
    "status": "passed"
  }
}
