{
  "$schema": "../../../report-part.schema.json",
  "capabilities": [
    {
      "category": "rtk-export",
      "classification": "behavioral",
      "id": "rtk.query-source.BaseQueryArg",
      "mismatch": null,
      "result": "same",
      "typescript": {
        "available": true,
        "evidence": [
          "BaseQueryArg",
          "node_modules/@reduxjs/toolkit/src/query/index.ts"
        ]
      },
      "unreal": {
        "available": true,
        "evidence": [
          "Source/ForbocAI_SDK/Public/Core/RTK/Query/Types/QueryTypes.hpp"
        ]
      }
    },
    {
      "category": "rtk-export",
      "classification": "behavioral",
      "id": "rtk.query-source.BaseQueryEnhancer",
      "mismatch": null,
      "result": "same",
      "typescript": {
        "available": true,
        "evidence": [
          "BaseQueryEnhancer",
          "node_modules/@reduxjs/toolkit/src/query/index.ts"
        ]
      },
      "unreal": {
        "available": true,
        "evidence": [
          "Source/ForbocAI_SDK/Public/Core/RTK/Query/Types/QueryTypes.hpp"
        ]
      }
    },
    {
      "category": "rtk-export",
      "classification": "behavioral",
      "id": "rtk.query-source.BaseQueryError",
      "mismatch": null,
      "result": "same",
      "typescript": {
        "available": true,
        "evidence": [
          "BaseQueryError",
          "node_modules/@reduxjs/toolkit/src/query/index.ts"
        ]
      },
      "unreal": {
        "available": true,
        "evidence": [
          "Source/ForbocAI_SDK/Public/Core/RTK/Query/Types/QueryTypes.hpp"
        ]
      }
    },
    {
      "category": "rtk-export",
      "classification": "behavioral",
      "id": "rtk.query-source.BaseQueryExtraOptions",
      "mismatch": null,
      "result": "same",
      "typescript": {
        "available": true,
        "evidence": [
          "BaseQueryExtraOptions",
          "node_modules/@reduxjs/toolkit/src/query/index.ts"
        ]
      },
      "unreal": {
        "available": true,
        "evidence": [
          "Source/ForbocAI_SDK/Public/Core/RTK/Query/Types/QueryTypes.hpp"
        ]
      }
    },
    {
      "category": "rtk-export",
      "classification": "behavioral",
      "id": "rtk.query-source.BaseQueryFn",
      "mismatch": null,
      "result": "same",
      "typescript": {
        "available": true,
        "evidence": [
          "BaseQueryFn",
          "node_modules/@reduxjs/toolkit/src/query/index.ts"
        ]
      },
      "unreal": {
        "available": true,
        "evidence": [
          "Source/ForbocAI_SDK/Public/Core/RTK/Query/Types/QueryTypes.hpp"
        ]
      }
    },
    {
      "category": "rtk-export",
      "classification": "behavioral",
      "id": "rtk.query-source.BaseQueryMeta",
      "mismatch": null,
      "result": "same",
      "typescript": {
        "available": true,
        "evidence": [
          "BaseQueryMeta",
          "node_modules/@reduxjs/toolkit/src/query/index.ts"
        ]
      },
      "unreal": {
        "available": true,
        "evidence": [
          "Source/ForbocAI_SDK/Public/Core/RTK/Query/Types/QueryTypes.hpp"
        ]
      }
    },
    {
      "category": "rtk-export",
      "classification": "behavioral",
      "id": "rtk.query-source.BaseQueryResult",
      "mismatch": null,
      "result": "same",
      "typescript": {
        "available": true,
        "evidence": [
          "BaseQueryResult",
          "node_modules/@reduxjs/toolkit/src/query/index.ts"
        ]
      },
      "unreal": {
        "available": true,
        "evidence": [
          "Source/ForbocAI_SDK/Public/Core/RTK/Query/Types/QueryTypes.hpp"
        ]
      }
    },
    {
      "category": "rtk-export",
      "classification": "behavioral",
      "id": "rtk.query-source.CombinedState",
      "mismatch": null,
      "result": "same",
      "typescript": {
        "available": true,
        "evidence": [
          "CombinedState",
          "node_modules/@reduxjs/toolkit/src/query/index.ts"
        ]
      },
      "unreal": {
        "available": true,
        "evidence": [
          "Source/ForbocAI_SDK/Public/Core/RTK/Query/Endpoint/Endpoint.hpp"
        ]
      }
    }
  ],
  "generatedBy": "scripts/check-rtk-parity.py",
  "reportId": "rtk-public-surface-parity.query-source.002",
  "schemaVersion": 1,
  "sources": {
    "typescript": {
      "commit": "50c1fe284da298525ea5a153d680084a06149ffe",
      "contractHashes": {
        "redux-toolkit-runtime-and-source": "506ad07549e03b33b8914d26436b37c4a23b7e45b549cfe015400e39c95b74f5"
      },
      "repository": "sdk"
    },
    "unreal": {
      "commit": "d7c04895692b1285ee49c318df9cd1e45dc58b01",
      "contractHashes": {
        "rtk-hpp-public-closure": "7b0722dd9ecd67441f44ca6214ffc7fdaa678084253142d0762c09729981662d"
      },
      "repository": "sdk-ue-5"
    }
  },
  "summary": {
    "capabilityCount": 8,
    "expectedMechanicCount": 0,
    "mismatchCount": 0,
    "sameCount": 8,
    "status": "passed"
  }
}
