{
  "$schema": "../../../report-part.schema.json",
  "capabilities": [
    {
      "category": "rtk-export",
      "classification": "behavioral",
      "id": "rtk.toolkit-source.DevToolsEnhancerOptions",
      "mismatch": null,
      "result": "same",
      "typescript": {
        "available": true,
        "evidence": [
          "DevToolsEnhancerOptions",
          "node_modules/@reduxjs/toolkit/src/index.ts"
        ]
      },
      "unreal": {
        "available": true,
        "evidence": [
          "Source/ForbocAI_SDK/Public/Core/RTK/Types/Types.hpp"
        ]
      }
    },
    {
      "category": "rtk-export",
      "classification": "behavioral",
      "id": "rtk.toolkit-source.Draft",
      "mismatch": null,
      "result": "same",
      "typescript": {
        "available": true,
        "evidence": [
          "Draft",
          "node_modules/@reduxjs/toolkit/src/index.ts"
        ]
      },
      "unreal": {
        "available": true,
        "evidence": [
          "Source/ForbocAI_SDK/Public/Core/RTK/Types/Types.hpp"
        ]
      }
    },
    {
      "category": "rtk-export",
      "classification": "behavioral",
      "id": "rtk.toolkit-source.DynamicDispatch",
      "mismatch": null,
      "result": "same",
      "typescript": {
        "available": true,
        "evidence": [
          "DynamicDispatch",
          "node_modules/@reduxjs/toolkit/src/index.ts"
        ]
      },
      "unreal": {
        "available": true,
        "evidence": [
          "Source/ForbocAI_SDK/Public/Core/RTK/Dynamic/DynamicMiddleware.hpp",
          "Source/ForbocAI_SDK/Public/Core/RTK/Types/Types.hpp"
        ]
      }
    },
    {
      "category": "rtk-export",
      "classification": "behavioral",
      "id": "rtk.toolkit-source.DynamicMiddlewareInstance",
      "mismatch": null,
      "result": "same",
      "typescript": {
        "available": true,
        "evidence": [
          "DynamicMiddlewareInstance",
          "node_modules/@reduxjs/toolkit/src/index.ts"
        ]
      },
      "unreal": {
        "available": true,
        "evidence": [
          "Source/ForbocAI_SDK/Public/Core/RTK/Dynamic/DynamicMiddleware.hpp"
        ]
      }
    },
    {
      "category": "rtk-export",
      "classification": "behavioral",
      "id": "rtk.toolkit-source.EnhancedStore",
      "mismatch": null,
      "result": "same",
      "typescript": {
        "available": true,
        "evidence": [
          "EnhancedStore",
          "node_modules/@reduxjs/toolkit/src/index.ts"
        ]
      },
      "unreal": {
        "available": true,
        "evidence": [
          "Source/ForbocAI_SDK/Public/Core/RTK/ConfigureStore/ConfigureStore.hpp"
        ]
      }
    },
    {
      "category": "rtk-export",
      "classification": "behavioral",
      "id": "rtk.toolkit-source.EntityAdapter",
      "mismatch": null,
      "result": "same",
      "typescript": {
        "available": true,
        "evidence": [
          "EntityAdapter",
          "node_modules/@reduxjs/toolkit/src/index.ts"
        ]
      },
      "unreal": {
        "available": true,
        "evidence": [
          "Source/ForbocAI_SDK/Public/Core/RTK/Entity/Adapter.hpp",
          "Source/ForbocAI_SDK/Public/Core/RTK/Entity/Types.hpp"
        ]
      }
    },
    {
      "category": "rtk-export",
      "classification": "behavioral",
      "id": "rtk.toolkit-source.EntityId",
      "mismatch": null,
      "result": "same",
      "typescript": {
        "available": true,
        "evidence": [
          "EntityId",
          "node_modules/@reduxjs/toolkit/src/index.ts"
        ]
      },
      "unreal": {
        "available": true,
        "evidence": [
          "Source/ForbocAI_SDK/Public/Core/RTK/Types/Types.hpp"
        ]
      }
    },
    {
      "category": "rtk-export",
      "classification": "behavioral",
      "id": "rtk.toolkit-source.EntitySelectors",
      "mismatch": null,
      "result": "same",
      "typescript": {
        "available": true,
        "evidence": [
          "EntitySelectors",
          "node_modules/@reduxjs/toolkit/src/index.ts"
        ]
      },
      "unreal": {
        "available": true,
        "evidence": [
          "Source/ForbocAI_SDK/Public/Core/RTK/Entity/Types.hpp"
        ]
      }
    }
  ],
  "generatedBy": "scripts/check-rtk-parity.py",
  "reportId": "rtk-public-surface-parity.toolkit-source.005",
  "schemaVersion": 1,
  "sources": {
    "typescript": {
      "commit": "9275069c0c42cd9127d74781de4abce9036358a2",
      "contractHashes": {
        "redux-toolkit-runtime-and-source": "506ad07549e03b33b8914d26436b37c4a23b7e45b549cfe015400e39c95b74f5"
      },
      "repository": "sdk"
    },
    "unreal": {
      "commit": "5cd51d43e7fe8bac369bdf7b77d9f74e85616785",
      "contractHashes": {
        "rtk-hpp-public-closure": "bb338647c7db6e66dca13a0ef3d6587c59cbcee5ec4e2906154e8f9ba0640447"
      },
      "repository": "sdk-ue-5"
    }
  },
  "summary": {
    "capabilityCount": 8,
    "expectedMechanicCount": 0,
    "mismatchCount": 0,
    "sameCount": 8,
    "status": "passed"
  }
}
