{
  "$schema": "../../../report-part.schema.json",
  "capabilities": [
    {
      "category": "rtk-export",
      "classification": "behavioral",
      "id": "rtk.query-source.SkipToken",
      "mismatch": null,
      "result": "same",
      "typescript": {
        "available": true,
        "evidence": [
          "SkipToken",
          "node_modules/@reduxjs/toolkit/src/query/index.ts"
        ]
      },
      "unreal": {
        "available": true,
        "evidence": [
          "Source/ForbocAI_SDK/Public/Core/RTK/Query/Types/QueryTypes.hpp"
        ]
      }
    },
    {
      "category": "rtk-export",
      "classification": "behavioral",
      "id": "rtk.query-source.StartQueryActionCreatorOptions",
      "mismatch": null,
      "result": "same",
      "typescript": {
        "available": true,
        "evidence": [
          "StartQueryActionCreatorOptions",
          "node_modules/@reduxjs/toolkit/src/query/index.ts"
        ]
      },
      "unreal": {
        "available": true,
        "evidence": [
          "Source/ForbocAI_SDK/Public/Core/RTK/Query/Types/QueryTypes.hpp"
        ]
      }
    },
    {
      "category": "rtk-export",
      "classification": "behavioral",
      "id": "rtk.query-source.SubscriptionOptions",
      "mismatch": null,
      "result": "same",
      "typescript": {
        "available": true,
        "evidence": [
          "SubscriptionOptions",
          "node_modules/@reduxjs/toolkit/src/query/index.ts"
        ]
      },
      "unreal": {
        "available": true,
        "evidence": [
          "Source/ForbocAI_SDK/Public/Core/RTK/Query/Api/Api.hpp",
          "Source/ForbocAI_SDK/Public/Core/RTK/Query/Types/QueryTypes.hpp"
        ]
      }
    },
    {
      "category": "rtk-export",
      "classification": "behavioral",
      "id": "rtk.query-source.TSHelpersId",
      "mismatch": null,
      "result": "same",
      "typescript": {
        "available": true,
        "evidence": [
          "TSHelpersId",
          "node_modules/@reduxjs/toolkit/src/query/index.ts"
        ]
      },
      "unreal": {
        "available": true,
        "evidence": [
          "Source/ForbocAI_SDK/Public/Core/RTK/Query/Endpoint/Endpoint.hpp"
        ]
      }
    },
    {
      "category": "rtk-export",
      "classification": "behavioral",
      "id": "rtk.query-source.TSHelpersNoInfer",
      "mismatch": null,
      "result": "same",
      "typescript": {
        "available": true,
        "evidence": [
          "TSHelpersNoInfer",
          "node_modules/@reduxjs/toolkit/src/query/index.ts"
        ]
      },
      "unreal": {
        "available": true,
        "evidence": [
          "Source/ForbocAI_SDK/Public/Core/RTK/Query/Endpoint/Endpoint.hpp"
        ]
      }
    },
    {
      "category": "rtk-export",
      "classification": "behavioral",
      "id": "rtk.query-source.TSHelpersOverride",
      "mismatch": null,
      "result": "same",
      "typescript": {
        "available": true,
        "evidence": [
          "TSHelpersOverride",
          "node_modules/@reduxjs/toolkit/src/query/index.ts"
        ]
      },
      "unreal": {
        "available": true,
        "evidence": [
          "Source/ForbocAI_SDK/Public/Core/RTK/Query/Endpoint/Endpoint.hpp"
        ]
      }
    },
    {
      "category": "rtk-export",
      "classification": "behavioral",
      "id": "rtk.query-source.TagDescription",
      "mismatch": null,
      "result": "same",
      "typescript": {
        "available": true,
        "evidence": [
          "TagDescription",
          "node_modules/@reduxjs/toolkit/src/query/index.ts"
        ]
      },
      "unreal": {
        "available": true,
        "evidence": [
          "Source/ForbocAI_SDK/Public/Core/RTK/Query/Endpoint/Endpoint.hpp"
        ]
      }
    },
    {
      "category": "rtk-export",
      "classification": "behavioral",
      "id": "rtk.query-source.TagTypesFromApi",
      "mismatch": null,
      "result": "same",
      "typescript": {
        "available": true,
        "evidence": [
          "TagTypesFromApi",
          "node_modules/@reduxjs/toolkit/src/query/index.ts"
        ]
      },
      "unreal": {
        "available": true,
        "evidence": [
          "Source/ForbocAI_SDK/Public/Core/RTK/Query/Endpoint/Endpoint.hpp"
        ]
      }
    }
  ],
  "generatedBy": "scripts/check-rtk-parity.py",
  "reportId": "rtk-public-surface-parity.query-source.009",
  "schemaVersion": 1,
  "sources": {
    "typescript": {
      "commit": "50c1fe284da298525ea5a153d680084a06149ffe",
      "contractHashes": {
        "redux-toolkit-runtime-and-source": "506ad07549e03b33b8914d26436b37c4a23b7e45b549cfe015400e39c95b74f5"
      },
      "repository": "sdk"
    },
    "unreal": {
      "commit": "e679082e67657f3c4d8f3ad0fc3a6eb7c067a021",
      "contractHashes": {
        "rtk-hpp-public-closure": "7b0722dd9ecd67441f44ca6214ffc7fdaa678084253142d0762c09729981662d"
      },
      "repository": "sdk-ue-5"
    }
  },
  "summary": {
    "capabilityCount": 8,
    "expectedMechanicCount": 0,
    "mismatchCount": 0,
    "sameCount": 8,
    "status": "passed"
  }
}
