{
  "$schema": "../../../report-part.schema.json",
  "capabilities": [
    {
      "category": "cli-command",
      "classification": "behavioral",
      "id": "cli.command.config_get",
      "mismatch": null,
      "result": "same",
      "typescript": {
        "available": true,
        "evidence": [
          "packages/core/data/cli/commands/config.json",
          "{\"browserBehavior\":null,\"group\":\"config\",\"subcommand\":\"get\",\"surfaces\":[\"node\",\"browser\"]}"
        ]
      },
      "unreal": {
        "available": true,
        "evidence": [
          "Content/Data/cli/commands/config.json",
          "{\"browserBehavior\":null,\"group\":\"config\",\"subcommand\":\"get\",\"surfaces\":[\"node\",\"browser\"]}"
        ]
      }
    },
    {
      "category": "cli-command",
      "classification": "behavioral",
      "id": "cli.command.config_list",
      "mismatch": null,
      "result": "same",
      "typescript": {
        "available": true,
        "evidence": [
          "packages/core/data/cli/commands/config.json",
          "{\"browserBehavior\":null,\"group\":\"config\",\"subcommand\":\"list\",\"surfaces\":[\"node\",\"browser\"]}"
        ]
      },
      "unreal": {
        "available": true,
        "evidence": [
          "Content/Data/cli/commands/config.json",
          "{\"browserBehavior\":null,\"group\":\"config\",\"subcommand\":\"list\",\"surfaces\":[\"node\",\"browser\"]}"
        ]
      }
    },
    {
      "category": "cli-command",
      "classification": "behavioral",
      "id": "cli.command.config_set",
      "mismatch": null,
      "result": "same",
      "typescript": {
        "available": true,
        "evidence": [
          "packages/core/data/cli/commands/config.json",
          "{\"browserBehavior\":null,\"group\":\"config\",\"subcommand\":\"set\",\"surfaces\":[\"node\",\"browser\"]}"
        ]
      },
      "unreal": {
        "available": true,
        "evidence": [
          "Content/Data/cli/commands/config.json",
          "{\"browserBehavior\":null,\"group\":\"config\",\"subcommand\":\"set\",\"surfaces\":[\"node\",\"browser\"]}"
        ]
      }
    }
  ],
  "generatedBy": "scripts/check-sdk-parity.py",
  "reportId": "sdk-capability-parity.cli-config.001",
  "schemaVersion": 1,
  "sources": {
    "typescript": {
      "commit": "25a149ec7286d8e4db1dbff8028a4a796575f5d0",
      "contractHashes": {
        "sdk-source-and-cli-contract": "a2057535fa2f6e5eb46248c683efcbdbfd023b29e395c9e177b49d42d270c386"
      },
      "repository": "sdk"
    },
    "unreal": {
      "commit": "2105e827cd5495f627708fe1b12ce10f7d0c2dc7",
      "contractHashes": {
        "sdk-source-and-cli-contract": "7495d4ea30335ba71c2b8845e0726f8efbb00bcab382ce20842dad63626870c2"
      },
      "repository": "sdk-ue-5"
    }
  },
  "summary": {
    "capabilityCount": 3,
    "expectedMechanicCount": 0,
    "mismatchCount": 0,
    "sameCount": 3,
    "status": "passed"
  }
}
